,Сливочное масло с солью,717,0.85,81.11,0.06
0,"Сливочное масло, взбитое с солью",718,0.49,78.3,2.87
1,Сливочное масло безводное,876,0.28,99.48,0.0
2,Сыр голубой,353,21.4,28.74,2.34
3,Сыр кирпичный,371,23.24,29.68,2.79
4,Сыр бри,334,20.75,27.68,0.45
5,Сыр камамбер,300,19.8,24.26,0.46
6,Сыр с тмином,376,25.18,29.2,3.06
7,"Сыр, чеддер",404,22.87,33.31,3.09
8,Сыр чеширский,387,23.37,30.6,4.78
9,"Сыр, колби",394,23.76,32.11,2.57
10,"Сыр, творог, взбитые сливки, крупный или мелкий творог",98,11.12,4.3,3.38
11,Сыр творожный со сливками с фруктами,97,10.69,3.85,4.61
12,"Сыр творожный, нежирный, без сливок, сухой, крупный или мелкий творожный",72,10.34,0.29,6.66
13,"Сыр творожный с низким содержанием жира, 2%-ный молочный жир",81,10.45,2.27,4.76
14,"Сыр творожный с низким содержанием жира, 1% молочного жира",72,12.39,1.02,2.72
15,"Сыр, сливки",350,6.15,34.44,5.52
16,Сыр эдам,357,24.99,27.8,1.43
17,Сыр фета,264,14.21,21.28,4.09
18,"Сыр ""фонтина""",389,25.6,31.14,1.55
19,"Сыр, джетост",466,9.65,29.51,42.65
20,Сыр гауда,356,24.94,27.44,2.22
21,Сыр грюйер,413,29.81,32.34,0.36
22,Сыр лимбургский,327,20.05,27.25,0.49
23,"Сыр, монтерей",373,24.48,30.28,0.68
24,"Сыр, моцарелла, цельное молоко",300,22.17,22.35,2.19
25,"Сыр, моцарелла, цельное молоко с низким содержанием влаги",318,21.6,24.64,2.47
26,"Сыр, моцарелла, частично обезжиренное молоко",254,24.26,15.92,2.77
27,"Сыр моцарелла с низким содержанием влаги, частично обезжиренный",295,23.75,19.78,5.58
28,Сыр мюнстерский,368,23.41,30.04,1.12
29,Сыр невшатель,253,9.15,22.78,3.59
30,"Сыр, тертый пармезан",420,28.42,27.84,13.91
31,Сыр твердый с пармезаном,392,35.75,25.83,3.22
32,Сыр порт-де-салют,352,23.78,28.2,0.57
33,Сыр проволоне,351,25.58,26.62,2.14
34,"Сыр, рикотта, цельное молоко",174,11.26,12.98,3.04
35,"Сыр, рикотта, частично обезжиренное молоко",138,11.39,7.91,5.14
36,Сыр романо,387,31.8,26.94,3.63
37,Сыр рокфор,369,21.54,30.64,2.0
38,Сыр швейцарский,393,26.96,30.99,1.44
39,Сыр тильзитский,340,24.41,25.98,1.88
40,"Сыр американский, пастеризованный, обогащенный витамином d",366,18.13,30.71,4.78
41,Сыр пименто пастеризованного производства,375,22.13,31.2,1.73
42,Сыр швейцарский пастеризованный,334,24.73,25.01,2.1
43,Сырный корм в холодной упаковке по-американски,331,19.66,24.46,8.32
44,"Сыр пищевой, пастеризованный, американский, обогащенный витамином d.",330,16.86,25.63,8.56
45,"Сыр пищевой, пастеризованный, швейцарский",323,21.92,24.14,4.5
46,Сырный спред пастеризованный по-американски,290,16.41,21.23,8.73
47,"Сливки, жидкость, пополам",123,3.13,10.39,4.73
48,"Крем жидкий, легкий (кофейный или столовый)",191,2.96,19.1,2.82
49,"Сливки, жидкие, для легкого взбивания",292,2.17,30.91,2.96
50,"Сливки, жидкие, для интенсивного взбивания",340,2.84,36.08,2.74
51,Сливки взбитые для посыпки сливками под давлением,257,3.2,22.22,12.49
52,"Сливки кислые с пониженным содержанием жира, кисломолочные",135,2.94,12.0,4.26
53,"Сливки кислые, кисломолочные",198,2.44,19.35,4.63
54,Гоголь - Моголь,88,4.55,4.19,8.05
55,"Сметанная заправка, нежирная, с кремообразной начинкой",178,3.25,16.57,4.68
56,"Молоко с начинкой, жидкое, со смесью гидрогенизированных растительных масел",63,3.33,3.46,4.74
57,"Молоко с начинкой, жидкое, с маслом лауриновой кислоты",63,3.33,3.4,4.74
58,"Сыр американский, обезжиренный или без жира",126,21.05,0.0,10.53
59,"Жидкий заменитель сливок с гидрогенизированными овощами, растительным маслом и соевым белком",136,1.0,9.97,11.38
60,Жидкий заменитель сливок с маслом лауриновой кислоты и казеинатом натрия,136,1.0,9.97,11.38
61,"Заменитель сливок, порошкообразный",529,2.48,32.92,59.29
62,Сахарная пудра для посыпки десерта,577,4.9,39.92,52.54
63,"Сухая начинка для десерта, 1,5 унции, приготовленная с 1/2 стакана молока",194,3.61,12.72,17.13
64,Десертная начинка под давлением,264,0.98,22.3,16.07
65,"Десертная начинка, полутвердая, замороженная",318,1.25,25.31,23.05
66,"Сметана искусственная, культивированная",208,2.4,19.52,6.63
67,Жидкие заменители молока с маслом лауриновой кислоты,61,1.75,3.41,6.16
68,"Молоко цельное, 3,25% молочного жира, с добавлением витамина d",61,3.15,3.25,4.8
69,"Молоко, производитель, жидкое, 3,7% молочного жира",64,3.28,3.66,4.65
70,"Молоко с пониженным содержанием жира, жидкое, 2%-ный молочный жир, с добавлением витамина А и витамина d",50,3.3,1.98,4.8
71,"Молоко с пониженным содержанием жира, жидкое, 2% молочного жира, с добавлением сухого обезжиренного молока, витамина А и витамина d",51,3.48,1.92,4.97
72,"Молоко с пониженным содержанием жира, жидкое, 2% молочного жира, обогащенное белком, с добавлением витаминов А и d",56,3.95,1.98,5.49
73,"Молоко нежирное, жидкое, с содержанием 1% молочного жира, с добавлением витамина А и витамина d",42,3.37,0.97,4.99
74,"Молоко обезжиренное, жидкое, 1%-ный уровень молочного жира, с добавлением сухого обезжиренного молока, витамин а/д",43,3.48,0.97,4.97
75,"Молоко нежирное, жидкое, с содержанием 1% молочного жира, обогащенное белком, с добавлением витаминов А и d",48,3.93,1.17,5.52
76,"Молоко обезжиренное, жидкое, с добавлением витамина А и витамина d (обезжиренное или обезжиренное)",34,3.37,0.08,4.96
77,"Молоко обезжиренное, жидкое, с добавлением сухого обезжиренного молока, витамина А и витамина d",37,3.57,0.25,5.02
78,"Молоко обезжиренное, жидкое, обогащенное белком, с добавлением витаминов А и d (обезжиренное/обезжиренное)",41,3.96,0.25,5.56
79,"Молоко, пахта жидкая, кисломолочная, с низким содержанием жира",40,3.31,0.88,4.79
80,"Молоко с низким содержанием натрия, жидкое",61,3.1,3.46,4.46
81,"Молоко сухое, цельное, с добавлением витамина d",496,26.32,26.71,38.42
82,"Молоко сухое, обезжиренное, обычное, без добавления витамина А и витамина d",362,36.16,0.77,51.98
83,"Молоко сухое, обезжиренное, быстрорастворимого приготовления с добавлением витамина А и витамина d",358,35.1,0.72,52.19
84,"Молоко сухое, обезжиренное, с пониженным содержанием кальция",354,35.5,0.2,51.8
85,"Молоко, пахта сухая",387,34.3,5.78,49.0
86,"Молоко консервированное, сгущенное, подслащенное",321,7.91,8.7,54.4
87,"Молоко консервированное, сгущенное, с добавлением витамина d и без добавления витамина А.",134,6.81,7.56,10.04
88,"Молоко консервированное сгущенное, обезжиренное, с добавлением витамина А и витамина d",78,7.55,0.2,11.35
89,"Молоко, шоколад, жидкий, коммерческий, цельный, с добавлением витамина А и витамина d",83,3.17,3.39,10.34
90,"Молоко, шоколад, жидкий, коммерческий, с пониженным содержанием жира",76,2.99,1.9,12.13
91,"Молоко, шоколад с низким содержанием жира, с добавлением витамина А и витамина d",62,3.46,1.0,9.86
92,"Молоко, шоколадный напиток, горячее какао, домашнее",77,3.52,2.34,10.74
93,"Молоко козье, жидкое, с добавлением витамина d",69,3.56,4.14,4.45
94,"Молоко человеческое, зрелое, жидкое",70,1.03,4.38,6.89
95,"Молоко, индийский буйволиный корм, жидкость",97,3.75,6.89,5.18
96,"Молоко, овечье, жидкое",108,5.98,7.0,5.36
97,Молочные коктейли с густым шоколадом,119,3.05,2.7,21.15
98,Молочные коктейли с густой ванилью,112,3.86,3.03,17.75
99,"Сыворотка, кислота, жидкость",24,0.76,0.09,5.12
100,"Сыворотка кислая, сухая",339,11.73,0.54,73.45
101,"Молочная сыворотка, сладкая, жидкая",27,0.85,0.36,5.14
102,"Сыворотка сладкая, сушеная",353,12.93,1.07,74.46
103,"Йогурт простой, из цельного молока, 8 граммов белка на 8 унций",61,3.47,3.25,4.66
104,"Йогурт простой, с низким содержанием жира, 12 граммов белка на 8 унций",63,5.25,1.55,7.04
105,"Йогурт, простое обезжиренное молоко, 13 граммов белка на 8 унций",56,5.73,0.18,7.68
106,"Йогурт, ваниль, с низким содержанием жира, 11 граммов белка на 8 унций",85,4.93,1.25,13.8
107,"Йогурт, фруктовый, с низким содержанием жира, 9 граммов белка на 8 унций",99,3.98,1.15,18.64
108,"Йогурт, фруктовый, с низким содержанием жира, 10 граммов белка на 8 унций",102,4.37,1.08,19.05
109,"Йогурт, фруктовый, с низким содержанием жира, 11 граммов белка на 8 унций",105,4.86,1.41,18.6
110,"Яйцо цельное, сырое, свежее",143,12.56,9.51,0.72
111,"Яйцо, белок, сырое, свежее",52,10.9,0.17,0.73
112,"Яйцо, желток, сырое, свежее",322,15.86,26.54,3.59
113,"Яйцо, желток, сырое, замороженное, пастеризованное",296,15.53,25.6,0.81
114,"Яйцо, желток, сырой, замороженный, засахаренный, пастеризованный",307,13.87,22.82,10.95
115,"Яйцо цельное, вареное, жареное",196,13.61,14.84,0.83
116,"Яйцо цельное, сваренное вкрутую",155,12.58,10.61,1.12
117,"Яйцо, цельное, вареное, омлет",154,10.57,11.66,0.64
118,"Яйцо цельное, вареное, пашот",143,12.51,9.47,0.71
119,"Яйцо цельное, вареное, омлет",149,9.99,10.98,1.61
120,"Яйцо цельное, сушеное",592,48.05,43.9,1.13
121,"Яйцо цельное, сушеное, стабилизированное, с пониженным содержанием глюкозы",615,48.17,43.95,2.38
122,"Яйцо, белок, сушеный, хлопья, стабилизированные, с пониженным содержанием глюкозы",351,76.92,0.04,4.17
123,"Яйцо, белок, сушеный, порошкообразный, стабилизированный, с пониженным содержанием глюкозы",376,82.4,0.04,4.47
124,"Яйцо, желток сушеный",669,33.63,59.13,0.66
125,"Яйцо утиное, цельное, свежее, сырое",185,12.81,13.77,1.45
126,"Яйцо гусиное, цельное, свежее, сырое",185,13.87,13.27,1.35
127,"Яйцо перепелиное, цельное, свежее, сырое",158,13.05,11.09,0.41
128,"Яйцо, индейка, цельное, свежее, сырое",171,13.68,11.88,1.15
129,Заменитель яиц в порошке,444,55.5,13.0,21.8
130,Сливочное масло без соли,717,0.85,81.11,0.06
131,Тертый сыр с пармезаном,415,37.86,27.34,3.41
132,"Молоко обезжиренное, жидкое, без добавления витамина А и витамина d (обезжиренное или обезжиренное)",34,3.37,0.08,4.96
133,"Молоко с пониженным содержанием жира, жидкое, 2% молочного жира, с сухим обезжиренным молоком, без витамина А",56,3.95,1.98,5.49
134,Молоко консервированное сгущенное с витамином А,134,6.81,7.56,10.04
135,"Молоко сухое, обезжиренное, обычное, с добавлением витамина А и витамина d",362,36.16,0.77,51.98
136,"Молоко сухое, обезжиренное, быстрорастворимого приготовления, без добавления витамина А и витамина d",358,35.1,0.72,52.19
137,"Сыр козий, твердый",452,30.52,35.59,2.17
138,"Сыр козий, полусухой",364,21.58,29.84,0.12
139,"Сыр козий, мягкий",264,18.52,21.08,0.0
140,"Яйцо, желток, сырое, замороженное, соленое, пастеризованное",275,14.07,22.93,1.77
141,"Заменитель сыра, моцарелла",248,11.47,12.22,23.67
142,"Сырный соус, приготовленный по рецепту",197,10.33,14.92,5.48
143,"Сыр по-мексикански, queso anejo",373,21.44,29.98,4.63
144,Сыр кесо асадеро по-мексикански,356,22.6,28.26,2.87
145,Сыр кесо чихуахуа по-мексикански,374,21.56,29.68,5.56
146,"Сыр нежирный, чеддер или колби",173,24.35,7.0,1.91
147,"Сыр с низким содержанием натрия, чеддер или колби",398,24.35,32.62,1.91
148,"Яйцо цельное, сырое, замороженное, пастеризованное",147,12.33,9.95,1.01
149,"Яйцо белое, сырое, замороженное, пастеризованное",48,10.2,0.0,1.04
150,Яйцо белое сушеное,382,81.1,0.0,7.8
151,"Молоко с пониженным содержанием жира, жидкое, 2% молочного жира, без добавления витамина А и витамина d",50,3.3,1.98,4.8
152,"Молоко жидкое, 1% жирности, без добавления витамина А и витамина d",42,3.37,0.97,4.99
153,Сметана с пониженным содержанием жира,181,7.0,14.1,7.0
154,Легкий сметанный крем,136,3.5,10.6,7.1
155,Сметана обезжиренная,74,3.1,0.0,15.6
156,"Сырье Министерства сельского хозяйства США, сыр, чеддер с пониженным содержанием жира",282,27.2,18.3,2.0
157,"Обезжиренное молоко со вкусом йогурта, вана или лема, подслащенное низкокалорийным подсластителем",43,3.86,0.18,7.5
158,Посыпка из обезжиренного сыра пармезан,370,40.0,5.0,40.0
159,"Сыр, сливки обезжиренные",105,15.69,1.0,7.66
160,"Йогурт, шоколад, обезжиренное молоко",112,3.53,0.0,23.53
161,Пастеризованный сырный соус Kraft cheez whiz,276,12.0,21.0,9.2
162,Легкий пастеризованный сырный продукт Kraft cheez whiz,215,16.3,9.5,16.2
163,Сырный продукт без крафта американский обезжиренный пастеризованный технологический сырный продукт,148,22.7,1.0,11.7
164,Пастеризованный сырный спред Kraft velveeta,303,16.3,22.0,9.8
165,Крафт-вельвета легкий пастеризованный сырный продукт с пониженным содержанием жира,222,19.6,10.6,11.8
166,Сметана с пониженным содержанием жира от Kraft breakstone,152,4.5,12.0,6.5
167,Обезжиренная сметана от Kraft breakstone,91,4.7,1.3,15.1
168,"Сливки, пополам, без жира",59,2.6,1.4,9.0
169,Взбитый топпинг Reddi wip без жира,149,3.0,5.0,25.0
170,"Молоко, шоколад, жидкий, коммерческий, с пониженным содержанием жира, с добавлением кальция",78,2.99,1.9,12.13
171,"Йогурт фруктовый, нежирный, с низкой калорийностью, калорийный подсластитель",105,4.86,1.41,18.6
172,"Сыр пармезан, сухой, натертый на терке, с пониженным содержанием жира",265,20.0,20.0,1.37
173,"Заменитель сливок, ароматизированный, жидкий",251,0.69,13.5,35.07
174,"Заменитель сливок, ароматизированный, порошкообразный",482,0.68,21.47,75.42
175,Сыр проволоне с пониженным содержанием жира,274,24.7,17.6,3.5
176,Сыр мексиканский блендерный с пониженным содержанием жира,282,24.69,19.4,3.41
177,"Яичная смесь, товар Министерства сельского хозяйства США",555,35.6,34.5,23.97
178,"Молоко цельное, 3,25% молочного жира, без добавления витамина А и витамина d",61,3.15,3.27,4.78
179,"Молоко сухое, цельное, без добавления витамина d",496,26.32,26.71,38.42
180,"Молоко консервированное, сгущенное, без добавления витамина А и витамина d",135,6.81,7.56,10.04
181,"Сырный продукт пастеризованного производства по-американски с пониженным содержанием жира, обогащенный витамином d",240,17.6,14.1,10.6
182,"Йогурт фруктовый, с низким содержанием жира, 9 граммов белка на 8 унций, обогащенный витамином d",99,3.98,1.15,18.64
183,"Йогурт фруктовый, с низким содержанием жира, 10 граммов белка на 8 унций, обогащенный витамином d",102,4.37,1.08,19.05
184,"Йогурт, фруктовый сорт, разновидности, нежирный, обогащенный витамином d",95,4.4,0.2,19.0
185,"Йогурт фруктовый, нежирный, с низкокалорийным подсластителем, обогащенный витамином d",105,4.86,1.41,18.6
186,"Йогурт с низким содержанием жира, ванили, 11 граммов белка на 8 унций, обогащенный витамином d",85,4.93,1.25,13.8
187,"Йогурт со вкусом ванили, обезжиренное молоко, с натуральным подсластителем, обогащенный витамином d",43,3.86,0.18,7.5
188,"Йогурт, шоколад, обезжиренное молоко, обогащенное витамином d",112,3.53,0.0,23.53
189,"Протеиновая добавка на основе молока, сухое мышечное молочко",411,45.71,17.14,18.5
190,"Протеиновая добавка на основе молока, muscle milk light, порошкообразная",396,50.0,12.0,22.0
191,Dulce de leche,315,6.84,7.35,55.35
192,"Заменитель яиц, жидкий или замороженный, без жира",48,10.0,0.0,2.0
193,Сыр белый сухой queso seco,325,24.51,24.35,2.04
194,"Сыр свежий, кесо фреско",299,18.09,23.82,2.98
195,Сыр белый кесо бланко,310,20.38,24.31,2.53
196,"Молоко, пахта, жидкое, цельное",62,3.21,3.31,4.88
197,"Йогурт со вкусом ванили, нежирное молоко, подслащенный низкокалорийным подсластителем",86,4.93,1.25,13.8
198,"Йогурт замороженный, со вкусом без шоколада, обезжиренное молоко, с низкокалорийным подсластителем",104,4.4,0.8,19.7
199,Мороженое мягкое для подачи с шоколадом,222,4.1,13.0,22.2
200,"Мороженое, батончик или палочка в шоколадной глазури",331,4.1,24.1,24.5
201,Сэндвич с мороженым,237,4.29,8.57,37.14
202,Сэндвич с печеньем - мороженым,240,3.7,7.4,39.6
203,"Рожок для мороженого, покрытый шоколадом, с орехами, со вкусом, отличным от шоколадного",354,5.21,21.88,34.38
204,"Сэндвич с мороженым, приготовленный из легкого ванильного мороженого",186,4.29,3.04,39.64
205,"Сэндвич с мороженым, ванильным, легким, без добавления сахара",200,5.71,2.86,42.86
206,"Мороженое обезжиренное, без добавления сахара, со вкусом, отличным от шоколадного",129,4.41,0.0,27.94
207,"Молочный десерт, десертный батончик, замороженный, приготовленный из нежирного молока",147,4.41,1.47,33.09
208,"Пищевая добавка для людей с сахарным диабетом, жидкая",88,4.4,3.08,11.88
209,"Сыр, мексиканская смесь",358,23.54,28.51,1.75
210,"Сырный продукт пастеризованный по-американски, обогащенный витамином d.",307,16.09,23.06,8.85
211,"Сыр американский, пастеризованный, без добавления витамина d",371,18.13,31.79,3.7
212,"Сыр пищевой, пастеризованный, американский, без добавления витамина d",330,16.86,25.63,8.56
213,"Яйцо цельное, сырое, замороженное, соленое, пастеризованное",138,10.97,10.07,0.83
214,"Йогурт греческий, простой, обезжиренный",59,10.19,0.39,3.6
215,"Яйцо белое сухое, стабилизированное, с пониженным содержанием глюкозы",357,84.08,0.32,4.51
216,Сырный спред на основе американского сыра или чеддера с пониженным содержанием жира,176,13.41,8.88,10.71
217,"Сыр, чеддер с пониженным содержанием жира",309,27.35,20.41,4.06
218,"Мороженое, легкое, мягкое для подачи, шоколадное",141,3.36,3.69,23.15
219,"Батончик мороженого, палочка или наггетсчик с хрустящей глазурью",358,2.11,25.26,37.12
220,"Сыр, чеддер обезжиренный или без жира",157,32.14,0.0,7.14
221,"Сыр швейцарский, обезжиренный или без жира",127,28.4,0.0,3.4
222,"Сыр по-мексикански, queso cotija",366,20.0,30.0,3.97
223,"Сыр чеддер острый, нарезанный ломтиками",410,24.25,33.82,2.13
