6561,Лапша яичная сухая обогащенная,384,14.16,4.44,71.27
6562,"Лапша яичная, обогащенная, приготовленная",138,4.54,2.07,25.16
6563,"Лапша, яйцо, шпинат, обогащенная, сухая",382,14.61,4.55,70.32
6564,"Лапша, яйцо, шпинат, обогащенная, приготовленная",132,5.04,1.57,24.25
6565,"Лапша китайская, чау-мейн",475,8.11,15.43,72.8
6566,"Лапша японская, соба сухая",336,14.38,0.71,74.62
6567,"Лапша японская, соба, приготовленная",99,5.06,0.1,21.44
6568,"Лапша японская, сомен, сухая",356,11.35,0.81,74.1
6569,"Лапша японская, сомен, приготовленная",131,4.0,0.18,27.54
6570,"Лапша плоская, хрустящая, китайский ресторан",521,10.33,31.72,51.9
6571,"Макаронные изделия сухие, обогащенные",371,13.04,1.51,74.67
6572,"Макароны отварные, обогащенные, без добавления соли",158,5.8,0.93,30.86
6573,Макароны цельнозерновые сухие,352,13.87,2.93,73.37
6574,Макароны цельнозерновые вареные,149,5.99,1.71,30.07
6575,Спагетти со шпинатом сухие,372,13.35,1.57,74.81
6576,"Спагетти со шпинатом, приготовленные",130,4.58,0.63,26.15
6577,"Пшеничная мука, хлеб необогащенный",361,11.98,1.66,72.53
6578,Ячменная мука или шрот,345,10.5,1.6,74.52
6579,Солодово-ячменная мука,361,10.28,1.84,78.3
6580,"Овсяная мука, частично очищенная от кожуры",404,14.66,9.12,65.7
6581,Рисовая лапша сухая,364,5.95,0.56,80.18
6582,"Рисовая лапша, приготовленная",108,1.79,0.2,24.01
6583,"Макароны цельнозерновые, 51% цельнозерновой муки, оставшаяся необогащенная манная крупа, сухие",362,13.51,2.68,73.1
6584,"Макароны цельнозерновые, 51% цельной пшеницы, оставшаяся необогащенная манная крупа, вареные",159,5.82,1.5,31.51
6585,"Киноа, приготовленная",120,4.4,1.92,21.3
6586,"Пшеница, камут хорасан, сырая",337,14.54,2.13,70.58
6587,"Пшеница, камут хорасан, приготовленная",132,5.71,0.83,27.6
6588,Полба сырая,338,14.57,2.43,70.19
6589,"Полба, приготовленная",127,5.5,0.85,26.44
6590,"Тефф, сырой",367,13.3,2.38,73.13
6591,"Тефф, приготовленный",101,3.87,0.65,19.86
6592,"Лапша яичная, вареная, обогащенная, с солью",138,4.54,2.07,25.16
6593,Кукурузное зерно белого цвета,365,9.42,4.74,74.26
6594,Кукурузная мука цельнозерновая голубая (harina de maiz morado),364,8.75,5.09,73.89
6595,Мука кукурузная цельнозерновая белая,361,6.93,3.86,76.85
6596,"Кукурузная мука, желтая, маса, обогащенная",363,8.46,3.69,76.59
6597,Кукурузная мука цельнозерновая белая,362,8.12,3.59,76.89
6598,"Макароны отварные, обогащенные, с добавлением соли",157,5.8,0.93,30.59
6599,"Кукурузная мука обезжиренная, обогащенная, белая",370,7.11,1.75,79.45
6600,"Кукурузная мука, белая, саморастворимая, в кляре, обычная, обогащенная",334,8.28,3.4,70.28
6601,"Кукурузная мука белая, самостоятельно поднимающаяся, взбитая, с добавлением пшеничной муки, обогащенная",348,8.41,2.85,73.43
6602,"Кукурузная мука белая, самовсходящаяся, обезжиренная, обогащенная",355,8.41,1.72,74.79
6603,Мамалыга консервированная желтого цвета,72,1.48,0.88,14.26
6604,"Рис белый, длиннозерный, обычный, вареный, обогащенный, с солью",130,2.69,0.28,28.17
6605,"Мука пшеничная белая, универсальная, обогащенная кальцием",364,10.33,0.98,76.31
6606,"Лапша яичная, сухая, необогащенная",384,14.16,4.44,71.27
6607,"Лапша яичная, необогащенная, приготовленная без добавления соли",138,4.54,2.07,25.16
6608,"Макароны сухие, необогащенные",371,13.04,1.51,74.67
6609,"Макароны отварные, необогащенные, без добавления соли",158,5.8,0.93,30.86
6610,"Кукурузная мука, обезжиренная, необогащенная, желтая",370,7.11,1.75,79.45
6611,"Рис белый, длиннозерный, обычный, сырой, необогащенный",365,7.13,0.66,79.95
6612,"Рис белый, длиннозерный, обычный, необогащенный, приготовленный без соли",130,2.69,0.28,28.17
6613,"Рис белый, длиннозерный, пропаренный, необогащенный, сухой",374,7.51,1.03,80.89
6614,"Рис белый, длиннозерный, пропаренный, необогащенный, вареный",123,2.91,0.37,26.05
6615,"Рис белый, среднезернистый, сырой, необогащенный",360,6.61,0.58,79.34
6616,"Рис белый, среднезернистый, вареный, необогащенный",130,2.38,0.21,28.59
6617,"Рис белый, короткозернистый, сырой, необогащенный",358,6.5,0.52,79.15
6618,"Рис белый, короткозернистый, вареный, необогащенный",130,2.36,0.19,28.73
6619,Манная крупа необогащенная,360,12.68,1.05,72.83
6620,"Мука пшеничная белая, универсальная, необогащенная",364,10.33,0.98,76.31
6621,"Лапша яичная, вареная, необогащенная, с солью",138,4.54,2.07,25.16
6622,"Макароны отварные, необогащенные, с добавлением соли",157,5.8,0.93,30.59
6623,"Кукурузная мука, обезжиренная, необогащенная, белая",370,7.11,1.75,79.45
6624,"Спагетти, обогащенные белком, вареные, обогащенные (n x 6,25)",164,8.86,0.21,30.88
6625,"Рис белый, длиннозерный, обычный, вареный, необогащенный, с солью",130,2.69,0.28,28.17
6626,"Мука пшеничная белая, универсальная, обогащенная, небеленая",364,10.33,0.98,76.31
6627,"Спагетти, обогащенные белком, сухие, обогащенные (n x 6,25)",374,21.78,2.23,65.65
6628,"Мука пшеничная белая (промышленная), 9% белка, отбеленная, обогащенная",367,8.89,1.43,77.32
6629,"Мука пшеничная белая (техническая), 9% белка, отбеленная, необогащенная",367,8.89,1.43,77.32
6630,"Мука пшеничная белая (промышленная), 10% белка, отбеленная, обогащенная",366,9.71,1.48,76.22
6631,"Мука пшеничная белая (промышленная), 10% белка, отбеленная, необогащенная",366,9.71,1.48,76.22
6632,"Мука пшеничная белая (промышленная), 10% белка, небеленая, обогащенная",366,9.71,1.48,76.22
6633,"Мука пшеничная белая (промышленная), 11,5% белка, отбеленная, обогащенная",363,11.5,1.45,73.81
6634,"Мука пшеничная белая (промышленная), 11,5% белка, отбеленная, необогащенная",363,11.5,1.45,73.81
6635,"Мука пшеничная белая (промышленная), 11,5% белка, небеленая, обогащенная",363,11.5,1.45,73.81
6636,"Мука пшеничная белая (промышленная), 13% белка, отбеленная, обогащенная",362,13.07,1.38,72.2
6637,"Мука пшеничная белая (промышленная), 13% белка, отбеленная, необогащенная",362,13.07,1.38,72.2
6638,"Мука пшеничная белая (промышленная), 15% белка, отбеленная, обогащенная",362,15.33,1.41,69.88
6639,"Мука пшеничная белая (техническая), 15% белка, отбеленная, необогащенная",362,15.33,1.41,69.88
6640,Пшенная мука,382,10.75,4.25,75.12
6641,Цельнозерновая мука из сорго,359,8.43,3.34,76.64
6642,Мука пшеничная цельнозерновая из мягкой пшеницы,332,9.61,1.95,74.48
6643,"Мука из сорго рафинированная, необогащенная",357,9.53,1.24,76.85
6644,"Рис коричневый, пропаренный, вареный, дядя бенс",147,3.09,0.85,31.33
6645,"Макароны цельнозерновые, 51% из цельной пшеницы, оставшаяся обогащенная манная крупа, вареные",156,5.67,1.48,30.87
6646,"Макаронные изделия из цельного зерна, 51% цельной пшеницы, оставшаяся обогащенная манная крупа, сухие",361,13.2,2.55,73.3
6647,"Макароны безглютеновые из коричневой рисовой муки, вареные, тинкьяда",138,3.46,1.67,32.2
6648,"Макаронные изделия без глютена из кукурузной муки и муки из киноа, приготовленные, старинный урожай",152,3.23,2.07,31.11
6649,"Макаронные изделия без глютена, с рисовой мукой и экстрактом рисовых отрубей, вареные, без косточек",200,4.21,1.7,40.75
6650,"Макароны безглютеновые из кукурузной и рисовой муки, приготовленные",179,3.2,1.0,38.05
6651,Бисквит быстрого приготовления с яйцом,274,8.53,16.23,23.46
6652,"Фаст-фуд, печенье с яйцом и беконом",305,11.33,20.73,19.06
6653,"Фаст-фуд, печенье с яйцом и ветчиной",233,10.64,14.08,16.37
6654,"Продукты для завтрака, бисквит с яйцом и колбасой",312,11.13,20.77,21.05
6655,"Фаст-фуды, бисквит с яйцом и стейком",277,12.12,19.21,14.37
6656,"Фаст-фуд, печенье с яйцом, сыром и беконом",301,12.01,17.48,24.44
6657,"Фаст-фуды, печенье с ветчиной",342,11.85,16.3,38.75
6658,"Фаст-фуды, печенье с колбасой",371,9.67,24.42,29.99
6659,Бисквит быстрого приготовления с хрустящим куриным филе,300,11.93,14.93,30.56
6660,"Фаст-фуд, круассан с яйцом и сыром",304,10.07,19.45,22.45
6661,"Фаст-фуд, круассан с яйцом, сыром и беконом",312,12.58,19.97,20.79
6662,"Фаст-фуд, круассан с яйцом, сыром и ветчиной",261,12.45,14.95,18.98
6663,"Фаст-фуд, круассан с яйцом, сыром и колбасой",308,12.09,21.78,15.9
6664,"Фаст-фуд, яйцо, омлет",212,13.84,16.18,2.08
6665,"Фаст-фуд, английский маффин с сыром и колбасой",338,13.28,20.67,25.28
6666,"Фаст-фуд, английский маффин с яйцом, сыром и канадским беконом",228,13.64,9.66,21.67
6667,"Фаст-фуд, английский маффин с яйцом, сыром и колбасой",286,13.38,18.1,17.44
6668,"Фаст-фуд, французские тосты с маслом",264,7.66,13.9,26.7
6669,"Фаст-фуды, французские тостовые палочки",340,6.0,17.74,41.21
6670,"Фаст-фуды, картофель, картофельные оладьи, круглые кусочки или котлеты",272,2.58,17.04,28.88
6671,"Мороженое быстрого приготовления, ванильное, легкое, мягкое-подавайте с рожком",163,4.24,4.86,26.36
6672,"Фаст-фуды, пломбир, карамель",196,4.71,5.98,31.81
6673,"Фаст-фуды, пломбир, горячая помадка",180,3.57,5.46,30.17
6674,"Фаст-фуды, пломбир, клубника",175,4.09,5.13,29.18
6675,"Фаст-фуды, креветки в панировке и жареные",308,7.84,18.9,27.99
6676,"Фаст-фуды, буррито с фасолью",206,6.48,6.22,32.92
6677,"Фаст-фуды, буррито с фасолью и сыром",205,7.35,6.05,31.23
6678,"Фаст-фуды, буррито с фасолью и говядиной",191,11.52,7.47,19.52
6679,"Фаст-фуды, буррито с фасолью, сыром и говядиной",180,7.03,6.8,23.37
6680,"Фаст-фуды, начос с сыром",343,4.32,21.5,34.91
6681,"Фаст-фуды, начос с сыром, фасолью, говяжьим фаршем и помидорами",219,6.21,12.48,21.39
6682,"Фаст-фуды, тако с говядиной, сыром и листьями салата в твердой оболочке",226,8.86,12.7,19.85
6683,"Фаст-фуды, салат тако",141,6.68,7.46,11.91
6684,"Фаст-фуд, чизбургер; один обычный пирожок; обычный",308,16.51,14.72,28.03
6685,"Фаст-фуд, чизбургер; одиночный, обычный пирожок, с приправой, приправы",270,13.49,12.9,25.46
6686,"Фаст-фуд, чизбургер; одиночный, обычный пирожок, с приправой, приправами и овощами, овощи",254,13.06,11.5,24.97
6687,"Фаст-фуд, чизбургер; двойной, обычный пирожок; обычный",308,17.16,17.4,20.8
6688,"Фаст-фуд, чизбургер; двойной, обычный пирожок, с приправой, приправами и овощами, овощи",251,12.8,12.7,21.2
6689,"Фаст-фуды, чизбургер, двойной, обычная котлета и булочка, с приправой, приправы",282,16.24,16.18,17.97
6690,"Фаст-фуды, чеббургеры; сырные, обычные, котлетные и мясные; с приправами, приправы и овощи, овощи",285,13.04,15.47,23.3
6691,"Фаст-фуд, чизбургер; один большой пирожок; обычный",310,17.29,15.97,24.07
6692,"Фаст-фуд, чезбургер; один большой пирожок; с приправами, приправами и беконом",282,15.78,15.86,18.89
6693,"Фаст-фуд, чизбургер; один большой пирожок; с приправой, приправы и овощи, овощи",206,11.59,10.36,16.81
6694,"Фаст-фуды, бургер; один большой пирожок; с приправой, приправами, овощами, овощами и ветчиной",286,15.55,18.97,13.01
6695,"Фаст-фуд, чизбургер; двойная большая котлета с приправой, приправами и овощами, овощи",273,14.72,16.92,15.37
6696,"Фаст-фуд, чизбургер; тройной, обычный пирожок; обычный",310,18.2,19.17,16.16
6697,"Фаст-фуд, сэндвич с куриным филе, простой с маринованными огурцами",250,16.28,11.19,20.89
6698,Сэндвич с рыбой быстрого приготовления с соусом тартар,257,10.29,12.45,26.69
6699,Сэндвич с рыбой быстрого приготовления с соусом тартар и сыром,279,11.26,14.64,26.39
6700,"Фаст-фуд, гамбургер; однослойный, обычный пирожок; обычный",297,16.52,12.01,31.5
6701,"Фаст-фуд, гамбургер; одиночный, обычный пирожок; с приправой, приправы",263,13.3,10.18,29.57
6702,"Фаст-фуд, гамбургер; одиночный, обычный пирожок; с приправой, приправами и овощами, овощи",254,11.74,12.25,24.81
6703,"Фаст-фуд, гамбургер; двойной, обычный, пирожок; обычный",295,17.08,14.36,24.1
6704,"Фаст-фуд, гамбургер; двойной, обычный пирожок; с приправой, приправы",268,14.8,15.1,18.02
6705,"Фаст-фуд, гамбургер; один большой пирожок; обычный",311,16.51,16.73,23.16
6706,"Фаст-фуды, гамбургер; один большой пирожок; с приправой, приправами и овощами, овощи",235,11.85,12.55,18.35
6707,"Фаст-фуд, гамбургер; двойная большая котлета; с приправой, приправы и овощи, овощи",239,15.17,11.75,17.82
6708,"Фаст-фуд, гамбургер, большая тройная котлета, с приправой, приправы",267,19.3,16.01,11.04
6709,"Фаст-фуд, хот-дог, простой",247,10.6,14.84,18.4
6710,"Фаст-фуд, хот-дог с чили",260,11.85,11.79,27.45
6711,"Фаст-фуды, хот-доги, покрытые кукурузной мукой (corndog)",263,9.6,10.8,31.88
6712,"Фаст-фуд, сэндвич с ростбифом, простой",244,15.17,10.3,22.21
6713,"Фаст-фуды, сэндвич ""подводная лодка"", мясное ассорти с листьями салата и помидорами",213,10.52,10.04,20.43
6714,"Фаст-фуды, сэндвич ""подводная лодка"", хлеб из ростбифа с листьями салата и помидорами",156,12.17,2.73,20.34
6715,"Фаст-фуды, сэндвич ""подводная лодка"", хлеб из тунца с листьями салата и помидорами",218,12.33,12.04,15.95
6716,"Фаст-фуды, салат из капусты",153,0.95,9.91,14.89
6717,"Фаст-фуды, hush puppies",296,6.16,13.25,40.21
6718,"Фаст-фуды, луковые кольца в панировке и жареные",411,3.86,25.23,43.58
6719,"Первые блюда, картофель, фрикадельки, обжаренные в растительном масле",312,3.43,14.73,41.44
6720,"Фаст-фуды, картофельное пюре",89,1.65,2.82,14.65
6721,"Гарниры, картофельный салат",114,1.53,6.03,13.53
6722,"Бургер кинг, ванильный коктейль",168,3.19,8.74,19.03
6723,"Фаст-фуд, печенье",370,7.08,18.92,42.82
6724,"Чик-фил-а, чик-н-стриптиз",228,21.4,11.2,10.39
6725,Картофельные оладьи с куриным филе,301,3.0,18.5,30.51
6726,"Школьный обед, пицца, big daddy's ls 16"" пицца из цельного сыра 51%, замороженная",243,13.89,8.81,27.1
6727,"Школьный обед, пицца, big daddy's 51% цельнозерновая пицца trky pep, замороженная",248,13.63,9.33,27.35
6728,"Школьный обед, пицца, пицца tony's smartpizza с сыром 50/50, замороженная",233,12.08,7.51,29.27
6729,"Школьный обед, пицца, tony's smartpizza pep pizza с сыром 50/50, замороженная",238,12.14,8.19,28.84
6730,"Школьный обед, пицца, сосиски для пиццы tony's breakfast, замороженные",240,10.39,10.04,26.99
6731,"Заменитель курицы Subway со сладким луком с добавлением brd lttc, tmt и сладкого лукового соуса",155,10.91,2.37,22.54
6732,"Фаст-фуды, заменители, курица со сладким луком, brd с lttc, tmt sweet onion",155,10.91,2.37,22.54
6733,"Subway, заменитель subway club на белом хлебе с листьями салата и помидорами",146,10.66,2.42,20.36
6734,"Фаст-фуды, сэндвич ""подводная лодка"", сочный ростбиф hm brd с lttc и tmt",146,10.66,2.42,20.36
6735,"Фаст-фуды, сэндвич на подводной лодке, запеченный в духовке chck wht brd lttc tmt",157,10.84,3.15,21.35
6736,"Фаст-фуды, сэндвичи на подводной лодке, trky brst wht brd lttc и tmt",147,9.12,2.31,22.42
6737,"Фаст-фуды, сэндвич ""подводная лодка"", ветчина на wht brd с lttc и tmt",151,9.12,2.53,22.91
6738,"Сабвей, заменитель фрикаделек в маринаре на белом хлебе (без начинки)",219,9.77,8.45,26.01
6739,"Фаст-фуды, сэндвич ""подводная лодка"", фрикадельки маринара на белом хлебе",219,9.77,8.45,26.01
6740,"Заменитель сабвей, стейка и сыра на wht brd с американским сыром, lttc и tmt",183,12.29,5.34,21.49
6741,"Фаст-фуды, сэндвич ""подводная лодка"", сырные палочки, сыр brd с сыром, lttc tmt",183,12.29,5.34,21.49
6742,"Заменитель Subway, b.l.t. на белом хлебе с беконом, листьями салата и помидорами",205,10.06,6.41,26.66
6743,"Фаст-фуды, сэндвич ""подводная лодка"", бекон, листья салата и помидоры белого цвета",205,10.06,6.41,26.66
6744,"Фаст-фуд, гамбургер, большая однослойная котлета, с приправой, приправы",256,15.68,11.6,22.14
6745,"Сабвей, заменитель грудки индейки на белом хлебе с листьями салата и помидорами",147,9.12,2.31,22.42
6746,"Заменитель ветчины ""Сабвей"", шварцвальд на белом хлебе с листьями салата и помидорами",151,9.12,2.53,22.91
6747,"Сабвей, заменитель ростбифа на белом хлебе с листьями салата и помидорами",155,12.17,2.73,20.34
6748,"Заменитель курицы, запеченной в духовке, на белом хлебе с листьями салата и помидорами",157,10.84,3.15,21.35
6749,"Сабвей, заменитель холодной нарезки на белом хлебе с листьями салата и помидорами",214,10.52,10.04,20.43
6750,"Сабвей, заменитель тунца на белом хлебе с листьями салата и помидорами",221,12.33,12.04,15.95
6751,"Пицца с сырной посыпкой, обычной корочкой, замороженная, приготовленная",268,10.36,12.28,29.02
6752,"Пицца с сырной посыпкой, поднимающейся корочкой, замороженная, приготовленная",260,12.37,8.78,32.91
6753,"Пицца с мясом и овощами, овощной посыпкой, обычной корочкой, замороженная, приготовленная",276,11.28,14.43,25.14
6754,"Пицца с мясом и овощами, овощной посыпкой, поднимающейся корочкой, замороженная, приготовленная",271,12.63,11.75,28.78
6755,"Макдоналдс, гамбургер",264,12.92,10.09,30.28
6756,"Курица быстрого приготовления, запанированная и обжаренная, кусочками без костей, обычная",307,15.92,20.36,14.93
6757,"Фаст-фуд, хрустящий сэндвич с куриным филе, листьями салата и майонезом",276,10.94,13.59,27.4
6758,"Mcdonald's, flt-o-fsh",282,11.26,14.64,26.39
6759,"Макдоналдс, чизбургер",263,12.97,11.79,27.81
6760,"Макдоналдс, четверть фунта",244,14.1,11.55,22.17
6761,"Макдональдс, четверть фунта с сыром",258,14.59,14.22,19.95
6762,"Макдоналдс, биг-мак",257,11.82,14.96,20.08
6763,"Макдональдс, частично обжаренный по-французски пар",323,3.41,15.47,42.58
6764,"Wendy's, классический одиночный гамбургер без сыра",213,12.63,10.6,16.82
6765,"Wendy's, классический одиночный гамбургер с сыром",221,14.87,11.6,14.2
6766,"Гамбургер Wendy's, jr. без сыра",243,12.62,8.75,28.45
6767,"Гамбургер Wendy's, jr. с сыром",256,13.06,11.5,24.97
