4420,"Напиток, фруктовый пунш-ароматизированный напиток, порошкообразный, без добавления натрия, приготовленный на воде'",37,0.0,0.01,9.47
4421,"Лимонад, замороженный концентрат, розовый",192,0.22,0.69,48.86
4422,"Напитки, лимонад, замороженный концентрат, розовый, приготовленный на воде'",43,0.05,0.15,10.81
4423,"Напитки, чай черный, заваренный, приготовленный на дистиллированной воде'",1,0.0,0.0,0.3
4424,"Напитки, чай, травы, заваренные, ромашка",1,0.0,0.0,0.2
4425,"Напитки, чай растворимый, с лимоном, с добавлением витамина С",385,0.6,0.3,97.6
4426,"Алкогольный напиток, дистиллированный, весь (джин, ром, водка, виски) 86 пробы",250,0.0,0.0,0.1
4427,"Алкогольный напиток, дистиллированный, весь (джин, ром, водка, виски) 90-й выдержки",263,0.0,0.0,0.0
4428,Газированный напиток с содовой со вкусом шоколада,42,0.0,0.0,10.7
4429,"Напитки, вино безалкогольное",6,0.5,0.0,1.1
4430,"Вода бутилированная, универсальная",0,0.0,0.0,0.0
4431,"Напиток, смесь напитков со вкусом шоколада для сухого молока с добавлением питательных веществ",400,4.55,2.27,90.28
4432,"Bev, смесь для напитков choco-fla, mlk, порошкообразная, с добавлением питательных веществ, приготовленная на цельном молоке",89,3.27,3.17,11.87
4433,"Напитки, вода', бутилированная, негазированная, evian",0,0.0,0.0,0.0
4434,"Напитки powerade zero ion4, без калорий, с различными вкусами",0,0.0,0.0,0.0
4435,"Напитки, wendy's, чай, готовый к употреблению, несладкий",1,0.22,0.0,0.0
4436,"Алкогольный напиток, вино столовое, разбавленное, мерло",83,0.07,0.0,2.51
4437,"Вода негазированная с фруктовыми ароматизаторами, подслащенная низкокалорийным подсластителем",1,0.0,0.0,0.13
4438,"Bev, вода""с добавлением витамина С и мин, в бутылках, подслащенная, с фруктовыми вкусами ast",22,0.0,0.0,5.49
4439,"Напитки, соковые напитки v8 splash, диетическая ягодная смесь",4,0.0,0.0,1.23
4440,"Напитки, соковые напитки v8 splash, диетическое фруктовое пюре",4,0.0,0.0,1.26
4441,"Напитки, соковые напитки v8 splash, диетическая клубника с киви",4,0.0,0.0,1.26
4442,"Напитки, соковые напитки v8 splash, диетическая тропическая смесь",4,0.0,0.0,1.26
4443,"Напитки, соковые напитки v8 splash, ягодная смесь",29,0.0,0.0,7.41
4444,"Напитки, соковые напитки v8 splash, фруктовое пюре",33,0.0,0.0,7.82
4445,"Напитки, соковые напитки v8 splash, гуава-маракуйя",33,0.0,0.0,7.82
4446,"Напитки, соковые напитки v8 splash, манго персиковый",33,0.0,0.0,8.23
4447,"Напитки, соковые напитки v8 splash, апельсиново-ананасовый",29,0.0,0.0,7.41
4448,"Напитки, соковые напитки v8 splash, фруктовый бленд",33,0.0,0.0,7.82
4449,"Напитки, соковые напитки v8 splash, клубнично-банановые",29,0.0,0.0,7.41
4450,"Напитки, соковые напитки v8 splash, клубника и киви",29,0.0,0.0,7.41
4451,"Напитки, соковые напитки v8 splash, тропическая смесь",29,0.0,0.0,7.41
4452,"Напитки, соки v8 v-фьюжн, персик и манго",49,0.41,0.0,11.38
4453,"Напитки, соки v8 v-fusion, клубнично-банановые",49,0.41,0.0,11.79
4454,"Напитки, соки v8 v-фьюжн, тропические",49,0.41,0.0,11.38
4455,"Напитки, соки v8 v- fusion, ягоды асаи",45,0.0,0.0,10.98
4456,"Напитки, энергетический напиток, усилитель",46,0.25,0.08,12.08
4457,"Напитки, энергетический напиток, полный газ",46,0.25,0.08,12.08
4458,"Напитки, энергетический напиток, монстр, обогащенный витаминами с, в2, в3, в6, в12",47,0.47,0.0,11.28
4459,"Напитки, энергетический напиток, без добавок, без сахара",2,0.0,0.0,1.03
4460,"Напитки, энергетический напиток, rockstar",58,0.34,0.22,12.7
4461,"Напитки, энергетический напиток, rockstar, без сахара",4,0.25,0.08,0.7
4462,"Бив, хорхата, сухая смесь, неподготовленный сорт, фирменные сорта, все с семенами морро",413,7.5,7.46,79.05
4463,"Напитки, добавка к пище, напиток консервированный со вкусом арахиса",101,3.5,3.07,14.74
4464,"Бевер, овощной, овощно-фруктовый соковый напиток, низкокалорийный, калорийный, с низкокалорийным подсластителем, с добавлением витамина С",4,0.0,0.0,1.1
4465,"Bev, молочный напиток с пониженным содержанием жира, ароматизированный и подслащенный, готовый к употреблению, с добавлением кальция, витаминов А и d",77,3.05,1.83,12.08
4466,"Напитки, смеси овощей и фруктовых соков с добавлением витаминов а, с, е",46,0.3,0.01,11.15
4467,"Напитки, фруктовый соковый напиток с пониженным содержанием сахара и добавлением витамина е",39,0.0,0.07,10.0
4468,"Вода с кукурузным сиропом и/или сахаром и низкокалорийным подсластителем, со вкусом фруктов",18,0.0,0.0,4.5
4469,"Напитки, хорчата, как подаются в ресторане",54,0.48,0.71,11.52
4470,"Напитки с рисовым молоком, несладкие",47,0.28,0.97,9.17
4471,"Напитки, энергетический напиток, хранилище, цитрусовый ароматизатор",49,0.0,0.0,12.99
4472,"Напитки, энергетический напиток, vault zero, без сахара, со вкусом цитрусовых",1,0.25,0.08,0.7
4473,"Напитки, pepsico quaker, gatorade g2, низкокалорийный, калорийный",8,0.05,0.01,1.94
4474,"Напитки, напиток со вкусом фруктов, менее 3% сока, не обогащенный витамином С",64,0.0,0.0,16.03
4475,"Bev, напиток со вкусом фруктов, содержащий 3% фруктового сока с высоким содержанием витамина С",27,0.0,0.0,6.67
4476,"Bev, напиток со вкусом фруктов, с пониженным содержанием сахара, > 3% фруктового сока, с высоким содержанием витамина С, с добавлением кальция.",29,0.0,0.37,6.67
4477,"Bev, фруктовый соковый напиток, более 3% фруктового сока, с высоким содержанием витамина С и добавлением тиамина",54,0.13,0.0,13.16
4478,"Напитки, чай, каркаде, заваренный",0,0.0,0.0,0.0
4479,"Напитки, фруктовый соковый напиток, более 3% сока, с высоким содержанием витамина С",46,0.13,0.11,11.35
4480,"Напитки, питательная смесь для коктейлей, с высоким содержанием белка, порошкообразные",392,53.57,10.71,20.38
4481,"Анчоус европейский, сырой",131,20.35,4.84,0.0
4482,"Анчоусы европейские, консервированные в масле, без сухих веществ",210,28.89,9.71,0.0
4483,"Окунь, пресноводный, смешанные виды, сырой",114,18.86,3.69,0.0
4484,"Окунь полосатый, сырой",97,17.73,2.33,0.0
4485,Голубая рыба в сыром виде,124,20.04,4.24,0.0
4486,"Налим, сырой",90,19.31,0.81,0.0
4487,Маслянистая рыба в сыром виде,146,17.28,8.02,0.0
4488,Карп сырой,127,17.83,5.6,0.0
4489,"Карп, приготовленный на сухом огне",162,22.86,7.17,0.0
4490,"Сом, канальный, дикий, сырой",95,16.38,2.82,0.0
4491,"Сом по-канальски, приготовленный, запанированный и обжаренный",229,18.09,13.33,8.04
4492,"Икра черная и измельченная, зернистая",264,24.6,17.9,4.0
4493,"Cisco, необработанный",98,18.99,1.91,0.0
4494,"Циско, копченый",177,16.36,11.9,0.0
4495,"Треска атлантическая, сырая",82,17.81,0.67,0.0
4496,"Треска атлантическая, приготовленная на сухом огне",105,22.83,0.86,0.0
4497,"Треска атлантическая, консервированная, твердая и жидкая",105,22.76,0.86,0.0
4498,"Треска атлантическая, сушеная и соленая",290,62.82,2.37,0.0
4499,"Рыба, треска тихоокеанская, сырая (возможно, была предварительно заморожена)",69,15.27,0.41,0.0
4500,"Квакша, атлантическая, сырая",104,17.78,3.17,0.0
4501,"Квакша атлантическая, приготовленная, в панировке и жареная",221,18.2,12.67,7.54
4502,"Куск, сырой",87,18.99,0.69,0.0
4503,Рыба махимахи в сыром виде,85,18.5,0.7,0.0
4504,"Барабанный, пресноводный, сырой",119,17.54,4.93,0.0
4505,"Угорь, смешанные виды, сырой",184,18.44,11.66,0.0
4506,"Угорь, смешанные виды, приготовленный на сухом огне",236,23.65,14.95,0.0
4507,"Рыба, рыбные палочки, замороженная, подготовленная",277,11.01,16.23,21.66
4508,Камбала (камбала и камбаловидные виды) сырая,70,12.41,1.93,0.0
4509,"Камбала (камбала и камбаловидные виды), приготовленная на сухом огне",86,15.24,2.37,0.0
4510,"Фаршированная рыба, коммерческий, сладкий рецепт",84,9.07,1.73,7.41
4511,"Морской окунь, смешанные виды, сырой",92,19.38,1.02,0.0
4512,"Морской окунь, смешанные виды, приготовленный на сухом огне",118,24.84,1.3,0.0
4513,Пикша сырая,74,16.32,0.45,0.0
4514,"Пикша, приготовленная на сухом огне",90,19.99,0.55,0.0
4515,Пикша копченая,116,25.23,0.96,0.0
4516,Палтус атлантический и тихоокеанский в сыром виде,91,18.56,1.33,0.0
4517,"Палтус атлантический и тихоокеанский, приготовленный в сухом виде",111,22.54,1.61,0.0
4518,Палтус гренландский в сыром виде,186,14.37,13.84,0.0
4519,"Сельдь атлантическая, сырая",158,17.96,9.04,0.0
4520,"Сельдь атлантическая, приготовленная на сухом огне",203,23.03,11.59,0.0
4521,Сельдь атлантическая маринованная,262,14.19,18.0,9.64
4522,Сельдь атлантическая с копченой рыбой,217,24.58,12.37,0.0
4523,"Сельдь тихоокеанская, сырая",195,16.39,13.88,0.0
4524,"Линг, сырой",87,18.99,0.64,0.0
4525,"Лингкодиректор, необработанный",85,17.66,1.06,0.0
4526,Скумбрия атлантическая в сыром виде,205,18.6,13.89,0.0
4527,"Скумбрия атлантическая, приготовленная на сухом огне",262,23.85,17.81,0.0
4528,"Скумбрия, домкрат, консервированная, сухая без воды",156,23.19,6.3,0.0
4529,"Скумбрия королевская, сырая",105,20.28,2.0,0.0
4530,"Скумбрия тихоокеанская и морская, смешанные виды, сырая",158,20.07,7.89,0.0
4531,"Скумбрия по-испански, сырая",139,19.29,6.3,0.0
4532,"Скумбрия по-испански, приготовленная на сухом огне",158,23.59,6.32,0.0
4533,Молочная рыба в сыром виде,148,20.53,6.73,0.0
4534,Морской аконит в сыром виде,76,14.48,1.52,0.0
4535,"Кефаль, полосатая, сырая",117,19.35,3.79,0.0
4536,"Кефаль полосатая, приготовленная на сухом огне",150,24.81,4.86,0.0
4537,"Морской окунь, атлантический, сырой",79,15.31,1.54,0.0
4538,"Морской окунь, атлантический, приготовленный в сухом виде",96,18.51,1.87,0.0
4539,"Надутый, океанский, сырой",79,16.64,0.91,0.0
4540,"Окунь, смешанные виды, сырой",91,19.39,0.92,0.0
4541,"Окунь, смешанные виды, приготовленный на сухом огне",117,24.86,1.18,0.0
4542,"Щука по-северному, сырая",88,19.26,0.69,0.0
4543,"Щука по-северному, приготовленная в сухом виде",113,24.69,0.88,0.0
4544,"Щука, судак в сыром виде",93,19.14,1.22,0.0
4545,"Минтай атлантический, сырой",92,19.44,0.98,0.0
4546,"Рыба минтай аляскинский, сырая (возможно, была предварительно заморожена)",56,12.19,0.41,0.0
4547,"Рыба, минтай по-аляскински, приготовленная в сухом виде (возможно, предварительно замороженная)",111,23.48,1.18,0.0
4548,"Помпано, Флорида, необработанный",164,18.48,9.47,0.0
4549,"Помпано, Флорида, приготовленный на сухом огне",211,23.69,12.14,0.0
4550,"Морской окунь, тихоокеанский, смешанные виды, сырой",90,18.36,1.34,0.0
4551,"Морской окунь, тихоокеанский, смешанные виды, приготовленный на сухом огне",109,22.23,1.62,0.0
4552,"Икра смешанных видов, сырая",143,22.32,6.42,1.5
4553,"Шероховатый, оранжевый, сырой",76,16.41,0.7,0.0
4554,"Чехонь, сырая",195,13.41,15.3,0.0
4555,Чехонь копченая,257,17.65,20.14,0.0
4556,"Лосось атлантический, дикий, сырой",142,19.84,6.34,0.0
4557,Лосось чавычный копченый,117,18.28,4.32,0.0
4558,"Лосось, чавыча сырая",179,19.93,10.43,0.0
4559,"Лосось, кета сырая",120,20.14,3.77,0.0
4560,"Лосось, кета, сушеные сухари с костью",141,21.43,5.5,0.0
4561,"Лосось, кижуч, дикий, сырой",146,21.62,5.93,0.0
4562,"Лосось, кижуч, дикий, приготовленный, влажный при высокой температуре",184,27.36,7.5,0.0
4563,"Лосось розовый, сырой",127,20.5,4.4,0.0
4564,"Рыба, лосось, розовая, консервированная, общее содержимое банки",129,19.68,4.97,0.0
4565,"Рыба, лосось, нерка сырая",131,22.25,4.69,0.0
4566,"Рыба, лосось, нерка, приготовленная на сухом огне",156,26.48,5.57,0.0
4567,"Рыба, лосось, нерка сухие консервированные",167,23.59,7.39,0.0
4568,"Сардины атлантические, консервированные в масле, сухие, без костей",208,24.62,11.45,0.0
4569,"Сардины тихоокеанские, консервированные в томатном соусе, сухие, без косточек",185,20.86,10.45,0.54
4570,"Скап, сырой",105,18.88,2.73,0.0
4571,"Морской окунь, смешанные виды, сырой",97,18.43,2.0,0.0
4572,"Морской окунь, смешанные виды, приготовленный на сухом огне",124,23.63,2.56,0.0
4573,"Проростки, смешанные виды, сырые",104,16.74,3.61,0.0
4574,"Нежирный, американский, сырой",197,16.93,13.77,0.0
4575,"Акула, смешанный вид, сырая",130,20.98,4.51,0.0
4576,"Акула смешанных видов, приготовленная, обмакнутая в кляр и обжаренная",228,18.62,13.82,6.39
4577,"Баранья голова, сырая",108,20.21,2.41,0.0
4578,"Баранья голова, приготовленная на сухом огне",126,26.02,1.63,0.0
4579,"Корюшка, радужная, сырая",97,17.63,2.42,0.0
4580,"Корюшка, радужная, приготовленная на сухом огне",124,22.6,3.1,0.0
4581,"Окунь, смешанные виды, сырой",100,20.51,1.34,0.0
4582,"Окунь, смешанные виды, приготовленный на сухом огне",128,26.3,1.72,0.0
4583,"Пятно, необработанное",123,18.51,4.9,0.0
4584,"Осетрина, смешанные виды, сырая",105,16.14,4.04,0.0
4585,"Осетрина смешанных видов, приготовленная на сухом огне",135,20.7,5.18,0.0
4586,"Осетрина смешанная, копченая",173,31.2,4.4,0.0
4587,"Присоска, белая, необработанная",92,16.76,2.32,0.0
4588,"Морская рыба, тыквенные семечки, сырая",89,19.4,0.7,0.0
4589,Сурими,99,15.18,0.9,6.85
4590,Рыба-меч в сыром виде,144,19.66,6.65,0.0
4591,"Рыба-меч, приготовленная на сухом огне",172,23.45,7.93,0.0
4592,Морская рыба в сыром виде,96,17.5,2.31,0.0
4593,"Рыба-плитка, приготовленная на сухом огне",147,24.49,4.69,0.0
4594,"Форель, смешанные виды, сырая",148,20.77,6.61,0.0
4595,"Форель радужная, дикая, сырая",119,20.48,3.46,0.0
4596,"Форель радужная, дикая, приготовленная в сухом виде",150,22.92,5.82,0.0
4597,"Тунец свежий, голубой, сырой",144,23.33,4.9,0.0
4598,"Тунец свежий, голубой, приготовленный на сухом огне",184,29.91,6.28,0.0
4599,"Тунец легкий, консервированный в масле, без сухих веществ",198,29.13,8.21,0.0
4600,"Рыба, тунец легкий, консервированный в воде, сухие продукты без масла",86,19.44,0.96,0.0
4601,"Тунец свежий, скипджек сырой",103,22.0,1.01,0.0
4602,"Тунец белый, консервированный в масле, без сухих веществ",186,26.53,8.08,0.0
4603,"Тунец белый, консервированный в воде, сухой",128,23.62,2.97,0.0
4604,"Тунец свежий, желтоперый, сырой",109,24.4,0.49,0.0
4605,Салат из тунца,187,16.04,9.26,9.41
4606,Тюрбо по-европейски в сыром виде,95,16.05,2.95,0.0
4607,"Сиг, смешанные виды, сырой",134,19.09,5.86,0.0
4608,"Сиг, смешанные виды, копченый",108,23.4,0.93,0.0
4609,"Путассу, смешанные виды, сырую",90,18.31,1.31,0.0
4610,"Путассу, смешанные виды, приготовленную на сухом огне",116,23.48,1.69,0.0
4611,"Рыба-волк, атлантическая, сырая",96,17.5,2.39,0.0
4612,"Желтохвост, смешанный вид, сырой",146,23.14,5.24,0.0
4613,"Королевский краб Аляски, сырой",84,18.29,0.6,0.0
4614,"Королевский краб Аляски, приготовленный во влажном теплом виде",97,19.35,1.54,0.0
4615,"Королевский краб аляски, имитация, приготовленный из сурими",95,7.62,0.46,15.0
4616,"Краб, голубой, сырой",87,18.06,1.08,0.04
4617,"Краб, голубой, приготовленный с высокой влажностью",83,17.88,0.74,0.0
4618,Крабы голубые консервированные,83,17.88,0.74,0.0
4619,"Ракообразные, крабы голубые, крабовые котлеты, домашний рецепт",155,20.21,7.52,0.48
4620,"Краб, сыроежка ""дангенесс""",86,17.41,0.97,0.74
4621,"Краб, королева, сырой",90,18.5,1.18,0.0
4622,"Раки смешанных видов, дикие, сырые",77,15.97,0.95,0.0
4623,"Раки, смешанные виды, дикорастущие, приготовленные, влажно-термические",82,16.77,1.2,0.0
4624,"Омар по-северному, сырой",77,16.52,0.75,0.0
4625,"Омар по-северному, приготовленный во влажном теплом виде",89,19.0,0.86,0.0
4626,"Ракообразные, креветки разных видов, сырые (возможно, предварительно замороженные)",71,13.61,1.01,0.91
4627,"Креветки разных видов, вареные, в панировке и жареные",242,21.39,12.28,11.47
4628,"Ракообразные, креветки разных видов, вареные, mst ht (возможно, предварительно замороженные)",119,22.78,1.7,1.52
4629,"Креветки смешанные, консервированные",100,20.42,1.36,0.0
4630,"Креветки смешанные, имитация, приготовленные из сурими",101,12.39,1.47,9.13
4631,"Колючий омар, смешанные виды, сырой",112,20.6,1.51,2.43
4632,"Морское ушко, смешанные виды, сырое",105,17.1,0.76,6.01
4633,"Морское ушко, смешанные виды, вареное, жареное",189,19.63,6.78,11.05
4634,"Моллюски смешанных видов, сырые",86,14.67,0.96,3.57
4635,"Моллюски разных видов, вареные, в панировке и жареные",202,14.24,11.15,10.33
4636,"Моллюски смешанных видов, приготовленные с высокой влажностью",148,25.55,1.95,5.13
4637,"Моллюски, смешанные виды, консервированные, сушеные сухие",142,24.25,1.59,5.9
4638,"Моллюски разных видов, консервированные, жидкие",2,0.4,0.02,0.1
4639,"Каракатица, смешанные виды, сырая",79,16.24,0.7,0.82
4640,"Мидии голубые, сырые",86,11.9,2.24,3.69
4641,"Мидии голубые, приготовленные, влажные при нагревании",172,23.8,4.48,7.39
4642,"Осьминог обыкновенный, сырой",82,14.91,1.04,2.2
4643,"Устрица восточная, дикая, сырая",51,5.71,1.71,2.72
4644,"Устрицы по-восточному, приготовленные, в панировке и жареные",199,8.77,12.58,11.62
4645,"Устрицы восточные, дикорастущие, приготовленные, влажно-горячие",102,11.42,3.42,5.45
4646,"Устрицы по-восточному, консервированные",68,7.06,2.47,3.91
4647,"Устрицы тихоокеанские, сырые",81,9.45,2.3,4.95
4648,"Морской гребешок, смешанные виды, сырой",69,12.06,0.49,3.18
4649,"Морской гребешок разных видов, приготовленный, запанированный и обжаренный",216,18.07,10.94,10.13
4650,"Морской гребешок, смешанные виды, имитация, приготовленный из сурими",99,12.77,0.41,10.62
4651,"Кальмары, смешанные виды, сырые",92,15.58,1.38,3.08
4652,"Кальмары разных видов, вареные, жареные",175,17.94,7.48,7.79
4653,"Моллюск неуказанный, сырой",137,23.84,0.4,7.76
