2356,"Сливы консервированные фиолетовые в упаковке с очень густым сиропом, твердые и жидкие",101,0.36,0.1,26.31
2357,Гранаты сырые,83,1.67,1.17,18.7
2358,Опунции сырые,41,0.73,0.51,9.57
2359,"Чернослив консервированный в упаковке с густым сиропом, твердый и жидкий",105,0.87,0.2,27.8
2360,"Чернослив обезвоженный (с низким содержанием влаги), сырой",339,3.7,0.73,89.07
2361,"Чернослив обезвоженный (с низким содержанием влаги), тушеный",113,1.23,0.24,29.7
2362,Сливы сушеные (чернослив) сырые,240,2.18,0.38,63.88
2363,"Сливы сушеные (чернослив), тушеные без добавления сахара",107,0.96,0.16,28.08
2364,"Сливы сушеные (чернослив), тушеные с добавлением сахара",124,1.09,0.22,32.88
2365,Консервированный сок из чернослива,71,0.61,0.03,17.45
2366,Пуммело в сыром виде,38,0.76,0.04,9.62
2367,Айва сырая,57,0.4,0.1,15.3
2368,Золотистый изюм без косточек,302,3.39,0.46,79.52
2369,Изюм без косточек,299,3.07,0.46,79.18
2370,Изюм без семян,296,2.52,0.54,78.47
2371,Рамбутан консервированный в упаковке с сиропом,82,0.65,0.21,20.87
2372,Малина сырая,52,1.2,0.65,11.94
2373,"Малина консервированная с пониженным содержанием жира, в упаковке с густым сиропом, сухая и жидкая",91,0.83,0.12,23.36
2374,"Малина замороженная, измельченная, подслащенная",103,0.7,0.16,26.16
2375,Ревень сырой,21,0.9,0.2,4.54
2376,"Ревень замороженный, сырой",21,0.55,0.11,5.1
2377,"Ревень замороженный, вареный, с сахаром",116,0.39,0.05,31.2
2378,"Розелла, сырая",49,0.96,0.64,11.31
2379,Розовые яблоки в сыром виде,25,0.6,0.3,5.7
2380,"Саподилла, сырая",83,0.44,1.1,19.96
2381,"Сапоте, мамай, сырое",124,1.45,0.46,32.1
2382,"Саусоп, сырой",66,1.0,0.3,16.84
2383,Клубника сырая,32,0.67,0.3,7.68
2384,"Клубника консервированная, в упаковке с густым сиропом, сухая и жидкая",92,0.56,0.26,23.53
2385,"Клубника замороженная, несладкая",35,0.43,0.11,9.13
2386,"Клубника замороженная, подслащенная, цельная",78,0.52,0.14,21.0
2387,"Клубника замороженная, подслащенная, нарезанная ломтиками",96,0.53,0.13,25.92
2388,"Яблоки с сахаром (sweetsop), сырые",94,2.06,0.29,23.64
2389,Тамаринды в сыром виде,239,2.8,0.6,62.5
2390,"Фруктовый салат тропический, консервированный, с густым сиропом, твердые и жидкие",86,0.41,0.1,22.36
2391,Арбуз сырой,30,0.61,0.15,7.55
2392,"Вишня мараскино консервированная, высушенная",165,0.22,0.21,41.97
2393,Фейхоа в сыром виде,61,0.71,0.42,15.21
2394,"Груши азиатские, сырые",42,0.5,0.23,10.65
2395,"Фруктовый коктейль консервированный с густым сиропом, слитый",70,0.47,0.1,18.8
2396,"Черника консервированная в легком сиропе, высушенная",88,1.04,0.4,22.66
2397,"Черника дикая консервированная с густым сиропом, слитая",107,0.56,0.34,28.32
2398,"Ананас консервированный, в упаковке с соком, высушенный",60,0.51,0.11,15.56
2399,"Консервированные абрикосы в густом сиропе, слить воду",83,0.64,0.11,21.31
2400,"Вишня кислая консервированная с водой в упаковке, слитая",42,0.69,0.21,10.45
2401,"Вишни сладкие, консервированные, без косточек, с густым сиропом, слить воду",83,0.73,0.21,21.07
2402,"Консервированные персики с густым сиропом, слить воду",72,0.52,0.18,18.43
2403,"Груши консервированные с густым сиропом, слить воду",74,0.24,0.18,19.08
2404,"Сливы консервированные с густым сиропом, слить воду",89,0.44,0.14,23.12
2405,"Мандарины (mandarin oranges) консервированные, в упаковке из-под сока, высушенные",38,0.75,0.04,9.41
2406,"Яблочный сок, консервированный или бутилированный, несладкий, с добавлением витамина С",46,0.1,0.13,11.3
2407,"Яблочное пюре консервированное, несладкое, с витамином С",42,0.17,0.1,11.27
2408,"Яблочное пюре консервированное, подслащенное, с солью",76,0.18,0.18,19.91
2409,Абрикосовый нектар консервированный с витамином С,56,0.37,0.09,14.39
2410,"Грейпфрутовый сок розовый, сырой",39,0.5,0.1,9.2
2411,Персиковый нектар консервированный с витамином С,54,0.27,0.02,13.92
2412,Грушевый нектар консервированный с витамином С,60,0.11,0.01,15.76
2413,"Ананасовый сок, консервированный или бутилированный, несладкий, с добавлением витамина С",53,0.36,0.12,12.87
2414,"Яблочный сок, замороженный концентрат, несладкий, неразбавленный, с витамином С",166,0.51,0.37,41.0
2415,"Яблочный сок, замороженный концентрат, несладкий, разбавленный 3-мя объемами воды, с витамином С",47,0.14,0.1,11.54
2416,"Груши сырые, бартлетт",63,0.39,0.16,15.01
2417,"Груши сырые, измельченные по-анжуйски",62,0.33,0.14,14.94
2418,Груши сырые в бошках,67,0.36,0.09,16.1
2419,"Груши сырые, зеленые по-анжуйски",66,0.44,0.1,15.79
2420,"Грейпфрутовый сок, белый, в бутылках, несладкий, океанский спрей",34,0.58,0.1,7.93
2421,Джекфрут консервированный в упаковке с сиропом,92,0.36,0.14,23.94
2422,"Даты, medjool",277,1.81,0.15,74.97
2423,"Дуриан, сырой или замороженный",147,1.47,5.33,27.09
2424,Пюре из чернослива,257,2.1,0.2,65.1
2425,Засахаренные фрукты,322,0.34,0.07,82.74
2426,"Абиюч, сырой",69,1.5,0.1,17.6
2427,"Рябина, сырая",111,2.3,2.0,23.9
2428,"Ананас, сырой, традиционный сорт, разновидности",45,0.55,0.13,11.82
2429,"Ананас сырой, очень сладкий сорт, разновидности",51,0.53,0.11,13.5
2430,"Товарный продукт Министерства сельского хозяйства США, фруктовые смеси (персик, груши, виноград), консервированные, со светлым сиропом, высушенные",57,0.46,0.1,14.65
2431,"Товар Министерства сельского хозяйства США, фруктовые смеси (персик, груша, виноград), консервы, светлый сыр, твердые и жидкие",55,0.41,0.08,14.3
2432,Клементины сырые,47,0.85,0.15,12.02
2433,Консервированный нектар Гуанабана,59,0.11,0.17,14.93
2434,Нектар гуавы консервированный с добавлением витамина С,63,0.09,0.06,16.25
2435,"Манговый нектар, консервированный",51,0.11,0.06,13.12
2436,Нектар из тамаринда консервированный,57,0.09,0.12,14.73
2437,"Товарные персики Министерства сельского хозяйства США, консервированные, в легком сиропе, высушенные",61,0.56,0.15,15.65
2438,"Груши товарные Министерства сельского хозяйства США, консервированные, в упаковке с соком, высушенные",51,0.34,0.19,12.91
2439,"Груши товарные Министерства Сельского хозяйства США, консервированные, в легком сиропе, высушенные",62,0.28,0.15,16.21
2440,Гранатовый сок в бутылках,54,0.15,0.29,13.13
2441,Смесь яблочного и виноградного соков с добавлением витамина С,50,0.16,0.12,12.46
2442,"Смесь яблочного, виноградного и грушевого соков с добавлением витамина С и кальция",52,0.17,0.12,12.96
2443,"Бананы зеленые, жареные",309,1.5,11.81,49.17
2444,"Бананы, желтые, жареные, латиноамериканский ресторан",236,1.42,7.51,40.77
2445,"Нэнси, консервированная, с сиропом, слитая",95,0.56,1.28,22.79
2446,"Нежирный, замороженный, несладкий",73,0.66,1.16,16.97
2447,"Мякоть наранхильи (луло) замороженная, несладкая",25,0.44,0.22,5.9
2448,Рогатая дыня (кивано),44,1.78,1.26,7.56
2449,Смесь апельсиново - ананасового сока,51,0.41,0.08,12.2
2450,"Яблоки сырые, очень вкусные, без кожицы",59,0.27,0.2,14.06
2451,"Яблоки, сырые, золотисто-вкусные, с кожурой",57,0.28,0.15,13.6
2452,"Яблоки сырые, granny smith, с кожурой",58,0.44,0.19,13.61
2453,"Яблоки сырые, праздничные, с кожурой",57,0.25,0.12,13.68
2454,"Яблоки сырые, фудзи, с кожурой",63,0.2,0.18,15.22
2455,"Апельсиновый сок охлажденный, в том числе из концентрата, с добавлением кальция и витаминов a, d, e",49,0.68,0.12,11.54
2456,"Смузи из фруктового сока, голый сок, могучее манго",63,0.42,0.0,15.0
2457,"Смузи из фруктового сока, голый сок, зеленая машина",53,0.6,0.26,12.53
2458,"Ананасовый сок консервированный, не из концентрата, несладкий, с добавлением витаминов А, с и е",50,0.36,0.14,12.18
2459,"Смузи из фруктового сока, голый сок, синяя машина",71,0.42,0.0,16.67
2460,"Виноградный сок, консервированный или бутилированный, несладкий, с добавлением витамина С и кальция",62,0.37,0.13,14.77
2461,"Смузи из фруктового сока, odwalla, оригинальный суперпродукт",50,0.63,0.36,11.51
2462,"Смузи из фруктовых соков, bolthouse farms, berry boost",46,0.63,0.02,10.9
2463,"Смузи с фруктовым соком, bolthouse farms, green goodness",56,0.63,0.33,13.04
2464,"Смузи из фруктового сока, bolthouse farms, клубнично-банановый",52,0.44,0.3,12.37
2465,"Яблочный сок, консервированный или бутилированный, несладкий, с добавлением витамина С, кальция и калия",48,0.12,0.17,11.49
2466,"Малина замороженная, несладкая",52,1.2,0.65,11.94
2467,"Нектар гуавы с сукралозой, консервированный",48,0.3,0.07,13.3
2468,"Киви, зеспри соленый, сырой",63,1.02,0.28,15.79
2469,"Смесь клюквенного сока, 100% сок в бутылках, с добавлением витамина С и кальция",45,0.27,0.12,10.91
2470,"Лимонный сок из концентрата, в бутылках, concord",24,0.4,0.07,5.37
2471,"Лимонный сок из концентрата, бутилированный, настоящий лимонный",17,0.47,0.07,5.66
2472,"Клюквенный соус целиком, консервированный, океанский спрей",158,0.75,0.05,40.4
2473,"Клюквенный соус, заливной, консервированный, океанский спрей",160,1.05,0.04,40.61
2474,"Рубиновый сок с пониженным содержанием жиров blnd (grpfrt, grp, apl), ocean spry, с витамином С",44,0.5,0.1,10.53
2475,"Смузи из фруктового сока, одвалла, клубнично-банановый",48,0.5,0.32,11.05
2476,"Смузи из фруктового сока, голый сок, клубнично-банановый",50,0.48,0.27,11.66
2477,"Свинина свежая, составная из жира, с добавлением раствора, приготовленная",585,10.06,60.42,0.32
2478,"Свинина свежая, туша, только нежирная и жирная, сырая",376,13.91,35.07,0.0
2479,"Свинина свежая, приготовленная из отрубов (ножка, корейка, лопатка), только нежирная, сырая",134,21.2,4.86,0.0
2480,"Свинина свежая, состоящая из ножки, корейки, лопатки и ребрышек, только нежирная и жирная, сырая",211,18.22,14.79,0.0
2481,"Свинина свежая, жирная, сырая",812,2.92,88.69,0.0
2482,"Свинина свежая, грудинка, сырая",518,9.34,53.01,0.0
2483,"Свинина свежая, жирная, сырая",632,9.25,65.7,0.0
2484,"Свинина свежая, жирная, вареная",626,7.06,66.1,0.0
2485,"Свинина свежая, окорок (ветчина), цельный, только нежирный и жирный, сырой",245,17.43,18.87,0.0
2486,"Свинина свежая, окорок (ветчина), цельный, только нежирный и жирный, вареный, жареный",273,26.83,17.61,0.0
2487,"Свинина свежая, ножка (окорок), целая, только нежирная, сырая",136,20.48,5.41,0.0
2488,"Свинина свежая, ножка (окорок), целая, только нежирная, вареная, жареная",211,29.41,9.44,0.0
2489,"Свинина свежая, ножка (окорок), половина огузка, только нежирные и жирные, сырые",182,20.27,10.63,0.0
2490,"Свинина свежая, ножка (окорок), половина огузка, только нежирные и жирные, вареные, запеченные",209,27.03,10.32,0.0
2491,"Свинина свежая, ножка (окорок), половинка огузка, только нежирная, сырая",120,21.81,2.93,0.0
2492,"Свинина свежая, ножка (окорок), половинка огузка, только нежирная, вареная, жареная",165,28.86,4.62,0.0
2493,"Свинина свежая, окорок, половина голени, только нежирные и жирные, сырые",193,19.87,11.96,0.0
2494,"Свинина свежая, окорок, половина голени, только нежирные и жирные, вареные, запеченные",232,25.96,13.42,0.0
2495,"Свинина свежая, окорок, половина голени, только нежирные, сырые",119,21.66,2.95,0.0
2496,"Свинина свежая, ножка (окорок), половина голени, только нежирная, вареная, запеченная",175,28.69,5.83,0.0
2497,"Свинина свежая, корейка, целая, только нежирная и жирная, сырая",198,19.74,12.58,0.0
2498,"Свинина свежая, корейка, целая, только нежирная и жирная, вареная, тушеная",239,27.23,13.62,0.0
2499,"Свинина свежая, корейка, целая, только нежирная и жирная, вареная, запеченная",242,27.32,13.92,0.0
2500,"Свинина свежая, корейка, целая, только нежирная и жирная, вареная, жареная",248,27.09,14.65,0.0
2501,"Свинина свежая, корейка, целая, только нежирная, сырая",143,21.43,5.66,0.0
2502,"Свинина свежая, корейка, целая, только нежирная, вареная, тушеная",204,28.57,9.12,0.0
2503,"Свинина свежая, корейка, целая, только нежирная, вареная, запеченная",210,28.57,9.8,0.0
2504,"Свинина свежая, корейка, целая, только нежирная, вареная, жареная",209,28.62,9.63,0.0
2505,"Свинина свежая, корейка, лопатка (отбивные или жаркое), без костей, только нежирная и жирная, сырая",194,19.56,12.27,0.0
2506,"Свинина свежая, корейка, лопатка (отбивные) без костей, только нежирная и жирная, вареная, тушеная",255,26.54,15.71,0.0
2507,"Свинина свежая, корейка, лопатка (отбивные) без костей, только нежирная и жирная, вареная, запеченная",231,23.72,14.35,0.0
2508,"Свинина свежая, корейка, лопатка (запеченная) с костями, только нежирная и жирная, вареная, запеченная",254,24.29,16.71,0.0
2509,"Свинина свежая, корейка, лопатка (отбивные или жаркое), без костей, только нежирная, сырая",143,21.22,5.84,0.0
2510,"Свинина свежая, корейка, лопатка (отбивные) без костей, только нежирная, вареная, тушеная",222,28.02,11.29,0.0
2511,"Свинина свежая, корейка, лопатка (отбивные) без костей, только нежирная, вареная, запеченная",193,24.99,9.56,0.0
2512,"Свинина свежая, корейка, лопатка (запеченная), без костей, только нежирная, вареная, запеченная",217,25.7,11.89,0.0
2513,"Свинина свежая, корейка, центральная часть корейки (отбивные), без костей, только нежирная и жирная, сырая",170,20.71,9.03,0.0
2514,"Свинина свежая, корейка, центральная часть корейки (отбивные), без костей, только нежирная и жирная, вареная, тушеная",242,28.21,13.51,0.0
2515,"Свинина свежая, корейка, центральная часть корейки (отбивные), без костей, только нежирная и жирная, вареная, запеченная",209,25.61,11.06,0.0
2516,"Свинина свежая, корейка, средняя часть корейки (для запекания), без костей, только нежирная и жирная, вареная, запеченная",231,27.01,12.8,0.0
2517,"Свинина свежая, корейка, центральная часть корейки (отбивные), без костей, только нежирная, сырая",127,21.99,3.71,0.0
2518,"Свинина свежая, корейка, центральная часть корейки (отбивные), без костей, только нежирная, вареная, тушеная",200,30.2,7.86,0.0
2519,"Свинина свежая, корейка, центральная часть корейки (отбивные), без костей, только нежирная, вареная, запеченная",180,26.76,7.29,0.0
2520,"Свинина свежая, корейка, средняя часть корейки (для запекания), без костей, только нежирная, вареная, запеченная",194,28.58,7.95,0.0
2521,"Свинина свежая, корейка, ребрышки посередине (отбивные или жаркое), без костей, только нежирные и жирные, сырые",186,20.28,11.04,0.0
2522,"Свинина свежая, корейка, ребрышки (отбивные) без костей, только нежирные и жирные, вареные, тушеные",261,26.66,16.28,0.0
2523,"Свинина свежая, корейка, ребрышки (отбивные) без костей, только нежирные, вареные, запеченные",222,24.42,13.04,0.0
2524,"Свинина свежая, корейка, центральное ребрышко (для запекания), без костей, только нежирная и жирная, вареная, запеченная",248,26.99,14.68,0.0
2525,"Свинина свежая, корейка, центральное ребрышко (отбивные или жаркое), без костей, только нежирная, сырая",136,21.79,4.8,0.0
2526,"Свинина свежая, корейка, ребрышки (отбивные) без костей, только нежирные, вареные, тушеные",208,29.03,9.32,0.0
2527,"Свинина свежая, корейка, ребрышки (отбивные) без костей, только нежирные, вареные, запеченные",186,25.79,8.36,0.0
2528,"Свинина свежая, корейка, центральное ребрышко (для запекания), без костей, только нежирная, вареная, запеченная",206,28.82,9.21,0.0
2529,"Свинина свежая, корейка (отбивные или жаркое), без костей, только нежирная и жирная, сырая",168,20.48,8.96,0.0
2530,"Свинина свежая, корейка, филейная часть (отбивные) без костей, только нежирная и жирная, вареная, тушеная",234,28.81,12.31,0.0
2531,"Свинина свежая, корейка, филейная часть (отбивные) без костей, только нежирная и жирная, вареная, запеченная",222,26.96,11.82,0.0
2532,"Свинина свежая, корейка, филейная часть (жаркое) без костей, только нежирная и жирная, вареная, запеченная",230,26.64,12.87,0.0
2533,"Свинина свежая, корейка (отбивные или жаркое), без костей, только нежирная, сырая",129,21.65,4.02,0.0
2534,"Свинина свежая, корейка (отбивные) без костей, только нежирная, вареная, тушеная",195,31.0,6.9,0.0
2535,"Свинина свежая, корейка (отбивные) без костей, только нежирная, вареная, запеченная",174,29.29,5.45,0.0
2536,"Свинина свежая, корейка, филейная часть (жаркое), без костей, только нежирная, вареная, запеченная",204,27.78,9.44,0.0
2537,"Свиная корейка свежая, нежирная, только в сыром виде",109,20.95,2.17,0.0
2538,"Свинина свежая, корейка, только нежирная, вареная, жареная",143,26.17,3.51,0.0
2539,"Свинина свежая, корейка, верхняя часть корейки (отбивные), без костей, только нежирная и жирная, сырая",155,21.55,6.94,0.0
2540,"Свинина свежая, корейка, верхняя часть корейки (отбивные), без костей, только нежирная и жирная, вареная, тушеная",200,29.2,8.31,0.0
2541,"Свинина свежая, корейка, верхняя часть корейки (отбивные), без костей, только нежирная и жирная, вареная, запеченная",196,26.62,9.14,0.0
2542,"Свинина свежая, корейка, верхняя часть корейки (для запекания), без костей, только нежирная и жирная, вареная, запеченная",192,26.45,8.82,0.0
